{
  "schema_version": "1.0.0",
  "command_id": "auth-test",
  "invocation_id": "22222222-2222-4222-8222-222222222222",
  "origin": "runner-observed",
  "argv": [
    "python",
    "-m",
    "pytest",
    "tests/auth",
    "-q"
  ],
  "shell": false,
  "shell_executable": null,
  "cwd": ".",
  "source_snapshot_sha256": "0000000000000000000000000000000000000000000000000000000000000000",
  "started_at": "2026-06-23T01:00:00Z",
  "finished_at": "2026-06-23T01:00:02Z",
  "duration_ms": 2000,
  "status": "exited",
  "exit_code": 0,
  "signal": null,
  "timeout_ms": 120000,
  "stdout": {
    "path": "observed/commands/auth-test.stdout",
    "sha256": "0000000000000000000000000000000000000000000000000000000000000000",
    "size_bytes": 12,
    "truncated": false
  },
  "stderr": {
    "path": "observed/commands/auth-test.stderr",
    "sha256": "0000000000000000000000000000000000000000000000000000000000000000",
    "size_bytes": 0,
    "truncated": false
  },
  "redaction_policy_sha256": null,
  "notes": []
}
